id,year,area,sp_area,day,body,alternatives,answer
01,2015,CH - Ciências Humanas,,D1,"QUESTÃO 01  
As autoridades de Kiribati, arquipélago do Oceano 
Pacífico formado por 33 atóis e uma ilha de coral, estão 
conscientizando sua população para que aceitem que, 
nas próximas décadas, terão de fugir do país. A estimativa 
é que, em um período de 50 anos, as ilhas podem 
desaparecer. O governo convocou os líderes de todas 
as ilhas para convencê-los da importância de mudar a 
mentalidade das pessoas, com pleno conhecimento que 
é uma questão muito sensível porque ameaça a própria 
identidade de um país. Kiribati já antecipou convênios 
com Austrália e Nova Zelândia para enviar seus cidadãos 
aos países vizinhos, algo que muitos dos moradores do 
arquipélago não aceitam.
No texto, faz-se referência a um problema que se tornou 
um tema recorrente na agenda global. Nesse sentido, 
a preocupação apresentada pela população de Kiribati 
fundamenta-se na previsão de","
A submersão de terras habitadas, decorrente da 
elevação do nível do mar.
B ocorrência de tsunamis, derivada de mudanças no 
eixo de rotação do planeta.
C erupções vulcânicas frequentes, visto que estão 
assentados sobre o Círculo do Fogo.
D terremotos com magnitude extrema, devido à 
proximidade de bordas de placas tectônicas.
E furacões de grande intensidade, em função de 
redução da temperatura média do Oceano Pacífico.",A
02,2015,CH - Ciências Humanas,,D1,"QUESTÃO 02  
Energia de Noronha virá da força das águas","
A energia de Fernando de Noronha virá do mar, do 
ar, do sol e até do lixo produzido por seus moradores e 
visitantes. É o que promete o projeto de substituição da 
matriz energética da ilha, que prevê a troca dos geradores 
atuais, que consomem 310 mil litros de diesel por mês.
No texto, está apresentada a nova matriz energética do 
Parque Nacional Marinho de Fernando de Noronha. 
a escolha por essa nova matriz prioriza o(a)
A expansão da oferta de energia, para aumento da 
atividade turística.
B uso de fontes limpas, para manutenção das condições 
ecológicas da região.
C barateamento dos custos energéticos, para estímulo 
da ocupação permanente.
D desenvolvimento de unidades complementares, para 
solução da carência energética local.
E diminuição dos gastos operacionais de transporte, 
para superação da distância do continente.",B
03,2015,CH - Ciências Humanas,,D1,"QUESTÃO 03  
No livro Por uma outra globalização, Milton Santos escreve:
Falava-se, antes, de autonomia da produção para 
significar que uma empresa, ao assegurar uma produção, 
buscava também manipular a opinião pela via da 
publicidade. Nesse caso, o fato gerador do consumo seria 
a produção. Mas, atualmente, as empresas hegemônicas 
produzem o consumidor antes mesmo de produzirem 
os produtos. Um dado essencial do entendimento do 
consumo é que a produção do consumidor, hoje, precede 
a produção dos bens e dos serviços.
O tipo de relação entre produção e consumo discutido no 
texto pressupõe o(a)","
A aumento do poder aquisitivo.
B estímulo à livre concorrência.
C criação de novas necessidades.
D formação de grandes estoques.
E implantação de linhas de montagem.",C
04,2015,CH - Ciências Humanas,,D1,"QUESTÃO 04  
Descrição da imagem: Cartum composto por 
três quadrinhos: no primeiro quadrinho, um homem 
cadeirante segura um jornal com a palavra “emprego” 
em destaque. No segundo quadrinho, o homem, 
sorridente, movimenta-se com a cadeira de rodas, 
segurando um pedaço de papel com a mão direita. 
No terceiro quadrinho, ele está perplexo e parado 
em frente a um cartaz com os dizeres: “Vagas para 
deficientes”. Na parte de baixo do cartaz, está escrito 
“Entre” em uma seta que aponta para uma escada. 
O cartum evidencia um desafio que o tema da inclusão 
social impõe às democracias contemporâneas. Esse 
desafio exige a combinação entre","
A participação política e formação profissional diferenciada.
B exercício da cidadania e políticas de transferência de renda.
C modernização das leis e ampliação do mercado de trabalho.
D universalização de direitos e reconhecimento das diferenças.
E crescimento econômico e flexibilização dos processos seletivos.",D
05,2015,CH - Ciências Humanas,,D1,"QUESTÃO 05  
Confidência do itabirano
De Itabira trouxe prendas diversas que ora te ofereço:
esta pedra de ferro, futuro aço do Brasil;
este São Benedito do velho santeiro Alfredo Durval;
este couro de anta, estendido no sofá de visitas;
este orgulho, esta cabeça baixa.
Tive ouro, tive gado, tive fazendas.
Hoje sou funcionário público.
Itabira é apenas uma fotografia na parede.
Mas como dói.
O poeta Carlos Drummond de Andrade pensa a região 
como lugar, pleno de afetos. A longa história da 
ocupação de Minas Gerais, iniciada com a mineração, 
deixou marcas que se atualizam em Itabira, pequena 
cidade onde nasceu o poeta. Nesse sentido, a evocação 
poética indica o(a)","
A pujança da natureza resistindo à ação humana.
B sentido de continuidade do progresso.
C cidade como imagem positiva da identidade mineira.
D percepção da cidade como paisagem da memória.
E valorização do processo de ocupação da região.",D
06,2015,CH - Ciências Humanas,,D1,"QUESTÃO 06  
Na obra Política, Aristóteles escreve:","
A utilidade do escravo é semelhante à do animal. 
Ambos prestam serviços corporais para atender às 
necessidades da vida. A natureza faz o corpo do 
escravo e do homem livre de forma diferente. O escravo 
tem corpo forte, adaptado naturalmente ao trabalho 
servil. Já o homem livre tem corpo ereto, inadequado ao 
trabalho braçal, porém apto à vida do cidadão.
O trabalho braçal é considerado, na filosofia 
aristotélica, como
A indicador da imagem do homem no estado de natureza.
B condição necessária para a realização da virtude humana.
C atividade que exige força física e uso limitado da racionalidade.
D referencial que o homem deve seguir para viver uma vida ativa.
E mecanismo de aperfeiçoamento do trabalho por meio da experiência.",C
07,2015,CH - Ciências Humanas,,D1,"QUESTÃO 07  
No livro O povo brasileiro, Darcy Ribeiro escreve:
É simplesmente espantoso que esses núcleos tão 
desiguais e tão diferentes se tenham mantido aglutinados 
numa só nação. Durante o período colonial, cada um 
deles teve relação direta com a metrópole. Ocorreu o 
extraordinário, fizemos um povo-nação, englobando 
todas aquelas províncias ecológicas numa só entidade 
cívica e política.
Após a conquista da autonomia, a questão primordial 
do Brasil residia em como garantir sua unidade 
político-territorial diante das características e práticas 
herdadas da colonização. Relacionando o projeto 
de independência à construção do Estado nacional 
brasileiro, a sua particularidade decorreu da","
A ordenação de um pacto que reconheceu os direitos políticos aos homens, independentemente de cor, sexo ou religião.
B estruturação de uma sociedade que adotou os privilégios de nascimento como critério de hierarquização social.
C realização de acordos entre as elites regionais, que evitou confrontos armados contrários ao projeto luso-brasileiro.
D concessão da autonomia política regional, que atendeu aos interesses socioeconômicos dos grandes proprietários.
E afirmação de um regime constitucional monárquico, que garantiu a ordem associada à permanência da escravidão.",E
08,2015,CH - Ciências Humanas,,D1,"QUESTÃO 08  
Descrição da imagem: Charge que mostra 
um aglomerado de casas simples, no alto de um 
morro. No local não existe planejamento urbano nem 
saneamento básico. O esgoto é lançado diretamente 
numa vala que passa bem próximo às casas. Em 
destaque estão três personagens: a mãe e dois filhos, 
um deles está brincando dentro da vala. De dentro 
de uma das casas a mãe liga de seu aparelho celular 
para o filho que está na outra margem da vala: 
- Alô, filho, tire seu irmão da vala negra. 
O filho, ao celular, responde:
- Sim, mãe.
As novas tecnologias foram massificadas, alcançando 
e impactando de diferentes formas os lugares. A ironia 
proposta pela charge indica que o acesso à tecnologia está","
A vinculado a mudanças na paisagem.
B garantido de forma equitativa aos cidadãos.
C priorizado para resolver as desigualdades.
D relacionado a uma ação redentora na vida social.
E dissociado de revoluções na realidade socioespacial.",E
09,2015,CH - Ciências Humanas,,D1,"QUESTÃO 09  
No livro Costumes em comum, Edward Thompson escreve:
Se vamos ter mais tempo de lazer no futuro 
automatizado, o problema não é como as pessoas vão 
consumir essas unidades adicionais de tempo de lazer, 
mas que capacidade para a experiência terão as pessoas 
com esse tempo livre. Mas se a notação útil do emprego 
do tempo se torna menos compulsiva, as pessoas talvez 
tenham de reaprender algumas das artes de viver que 
foram perdidas na Revolução Industrial: como preencher 
os interstícios de seu dia com relações sociais e pessoais; 
como derrubar mais uma vez as barreiras entre o trabalho e a vida.
a partir da reflexão do historiador, um argumento contrário 
à transformação promovida pela Revolução Industrial na 
relação dos homens com o uso do tempo livre é o(a)","
A intensificação da busca do lucro econômico.
B flexibilização dos períodos de férias trabalhistas.
C esquecimento das formas de sociabilidade tradicionais.
D aumento das oportunidades de confraternização familiar.
E multiplicação das possibilidades de entretenimento virtual.",C
10,2015,CH - Ciências Humanas,,D1,QUESTÃO 10  ,"
A razão principal que leva o capitalismo como sistema 
a ser tão terrivelmente destrutivo da biosfera é que, na 
maioria dos casos, os produtores que lucram com a 
destruição não a registram como um custo de produção, 
mas sim, precisamente ao contrário, como uma redução 
no custo. Por exemplo, se um produtor joga lixo em um rio, 
poluindo suas águas, esse produtor considera que está 
economizando o custo de outros métodos mais seguros, 
porém mais caros de dispor do lixo.
a pressão dos movimentos socioambientais, na tentativa 
de reverter a lógica descrita no texto, aponta para a
A emergência de um sistema econômico global que secundariza os lucros.
B redução dos custos de tratamento de resíduos pela isenção fiscal das empresas.
C flexibilização do trabalho como estratégia positiva de corte de custos empresariais.
D incorporação de um sistema normativo ambiental no processo de produção industrial.
E minimização do papel do Estado em detrimento das organizações não governamentais.",D
11,2015,CH - Ciências Humanas,,D1,"QUESTÃO 11  
a humanidade conhece, atualmente, um fenômeno espacial novo: pela primeira vez na história humana, a 
população urbana ultrapassa a rural no mundo. Todavia, a urbanização é diferenciada entre os continentes.
No texto, faz-se referência a um processo espacial de escala mundial. Um indicador das diferenças continentais 
desse processo espacial está presente em:","
A Orientação política de governos locais.
B Composição religiosa de povos originais.
C Tamanho desigual dos espaços ocupados.
D Distribuição etária dos habitantes do território.
E Grau de modernização de atividades econômicas.",E
12,2015,CH - Ciências Humanas,,D1,"QUESTÃO 12  
Descrição da imagem: Cartograma com a classificação dos países e das regiões, de acordo com o consumo 
de energia elétrica per capita, em 2007 (tep). A legenda indica cinco faixas de consumo: 
De 0 a 1,5: México, América Central, parte da América do Sul, incluindo o Brasil, quase todo o continente 
africano e a maior parte do sudeste asiático.
De 1,5 a 3,0: Groenlândia, Venezuela, Argentina, Chile, África do Sul, parte ocidental da Europa, Cazaquistão, 
Japão e Nova Zelândia.
De 3,0 a 4,5: Iêmen, Omã, Afeganistão, Irã, Paquistão, Polônia, Ucrânia e Bulgária.
De 4,5 a 6,0: parte setentrional da Europa, Rússia e Austrália.
Maior que 6,0: Estados Unidos, Canadá, Finlândia e Arábia Saudita.
a distribuição do consumo de energia elétrica per capita, verificada no cartograma, é resultado da","
A extensão territorial dos Estados-nação.
B diversificação da matriz energética local.
C capacidade de integração política regional.
D proximidade com áreas de produção de petróleo.
E instalação de infraestrutura para atender à demanda.",E
13,2015,CH - Ciências Humanas,,D1,"QUESTÃO 13  
O ícone dos conflitos que assolam a região da bacia do Xingu na atualidade é o projeto da hidrelétrica de Belo 
Monte. Prevista para ser implantada no Médio Xingu, tem a capacidade de gerar, segundo os estudos da Eletronorte, 
11 mil megawatts de energia, o que faria dela a segunda maior hidrelétrica do Brasil. Entre adesivos que refletem o 
teor polêmico do projeto — “Eu quero Belo Monte” e “Fora Belo Monte” —, os moradores de Altamira, cidade polo da 
região onde a usina deverá ser construída, se dividem.
Na polêmica apresentada, de acordo com a perspectiva dos trabalhadores da região, um argumento favorável e outro 
contrário à implementação do projeto estão, respectivamente, na","
A urbanização da periferia e valorização dos imóveis rurais.
B recuperação da autoestima e criação de empregos qualificados.
C expansão de lavouras e crescimento do assalariamento agrícola.
D captação de investimentos e expropriação dos posseiros pobres.
E adoção do preservacionismo e estabelecimento de reservas permanentes.",D
14,2015,CH - Ciências Humanas,,D1,"QUESTÃO 14  
TEXTO I
Fragmento da canção A melhor banda de todos os 
tempos da última semana, dos Titãs:","
A melhor banda de todos os tempos da última semana
O melhor disco brasileiro de música americana
O melhor disco dos últimos anos de sucessos do passado
O maior sucesso de todos os tempos entre os dez maiores fracassos
Não importa contradição
O que importa é televisão
Dizem que não há nada que você não se acostume
Cala a boca e aumenta o volume então.
TEXTO II
No texto O fetichismo na música e a regressão da 
audição, Adorno escreve:
Aldous Huxley levantou em um de seus ensaios a 
seguinte pergunta: quem ainda se diverte realmente hoje 
num lugar de diversão? Com o mesmo direito poder-se-ia 
perguntar: para quem a música de entretenimento serve 
ainda como entretenimento? Ao invés de entreter, parece 
que tal música contribui ainda mais para o emudecimento 
dos homens, para a morte da linguagem como expressão, 
para a incapacidade de comunicação.
a aproximação entre a letra da canção e a crítica de 
Adorno indica o(a)
A lado efêmero e restritivo da indústria cultural.
B baixa renovação da indústria de entretenimento.
C influência da música americana na cultura brasileira.
D fusão entre elementos da indústria cultural e da cultura popular.
E declínio da forma musical em prol de outros meios de entretenimento.",A
15,2015,CH - Ciências Humanas,,D1,"QUESTÃO 15  
Na obra Fundamentação da metafísica dos 
costumes, Kant escreve:","
A pura lealdade na amizade, embora até o presente 
não tenha existido nenhum amigo leal, é imposta a todo 
homem, essencialmente, pelo fato de tal dever estar 
implicado como dever em geral, anteriormente a toda 
experiência, na ideia de uma razão que determina a 
vontade segundo princípios a priori.
a passagem citada expõe um pensamento caracterizado pela
A eficácia prática da razão empírica.
B transvaloração dos valores judaico-cristãos.
C recusa em fundamentar a moral pela experiência.
D comparação da ética a uma ciência de rigor matemático.
E importância dos valores democráticos nas relações de amizade.",C
16,2015,CH - Ciências Humanas,,D1,QUESTÃO 16  ,"
A conquista pelos ingleses de grandes áreas da Índia 
deu o impulso inicial à produção e venda organizada 
de ópio. A Companhia das Índias Orientais obteve o 
monopólio da compra do ópio indiano e depois vendeu 
licenças para mercadores selecionados, conhecidos como 
“mercadores nativos”. Depois de vender ópio na China, 
esses mercadores depositavam a prata que recebiam 
por ele com agentes da companhia em Cantão, em troca 
de cartas de crédito; a companhia, por sua vez, usava a 
prata para comprar chá, porcelana e outros artigos que 
seriam vendidos na Inglaterra.
A análise das trocas comerciais citadas permite 
interpretar as relações de poder que foram estabelecidas. 
a partir desse pressuposto, o processo sócio-histórico 
identificado no texto é
A a expansão político-econômica de países do Oriente, iniciada nas últimas décadas do século XX. 
B a consolidação do cenário político entreguerras, na primeira metade do século XX. 
C o colonialismo europeu, que marcou a expansão europeia no século XV.
D o imperialismo, cujo ápice ocorreu na segunda metade do século XIX.
E as libertações nacionais, ocorridas na segunda metade do século XX.",D
17,2015,CH - Ciências Humanas,,D1,"QUESTÃO 17  
Descrição da imagem: Uma representação 
cartográfica em formato circular. O Rio Tanais e o 
Mar Vermelho marcam a divisão da representação 
circular entre as metades superior e inferior. A metade 
superior do círculo está ocupada pelo continente 
asiático e contém uma ilustração do paraíso e de uma 
igreja, indicando Jerusalém, localizada no centro da 
representação cartográfica. Na metade inferior, estão 
representados em proporções iguais, lado a lado, os 
continentes africano e europeu que são divididos pelo 
Mar Mediterrâneo.
As diferentes representações cartográficas trazem 
consigo as ideologias de uma época. A representação 
destacada se insere no contexto das Cruzadas por","
A revelar aspectos da estrutura demográfica de um povo.
B sinalizar a disseminação global de mitos e preceitos políticos.
C utilizar técnicas para demonstrar a centralidade de algumas regiões.
D mostrar o território para melhor administração dos recursos naturais.
E refletir a dinâmica sociocultural associada à visão de mundo eurocêntrica.",C
18,2015,CH - Ciências Humanas,,D1,"QUESTÃO 18  
Não acho que seja possível identificar a globalização 
apenas com a criação de uma economia global, embora 
este seja seu ponto focal e sua característica mais óbvia. 
Precisamos olhar além da economia. Antes de tudo, 
a globalização depende da eliminação de obstáculos 
técnicos, não de obstáculos econômicos. Isso tornou 
possível organizar a produção, e não apenas o comércio, 
em escala internacional.
Um fator essencial para a organização da produção, na 
conjuntura destacada no texto, é a","
A criação de uniões aduaneiras.
B difusão de padrões culturais.
C melhoria na infraestrutura de transportes.
D supressão das barreiras para comercialização.
E organização de regras nas relações internacionais.",C
19,2015,CH - Ciências Humanas,,D1,"QUESTÃO 19  
Na obra Meditações, René Descartes escreve:
Após ter examinado cuidadosamente todas as 
coisas, cumpre enfim concluir e ter por constante que 
esta proposição, eu sou, eu existo, é necessariamente 
verdadeira todas as vezes que a enuncio ou que a 
concebo em meu espírito.
a proposição “eu sou, eu existo” corresponde a um dos 
momentos mais importantes na ruptura da filosofia do 
século XVII com os padrões da reflexão medieval, por","
A estabelecer o ceticismo como opção legítima.
B utilizar silogismos linguísticos como prova ontológica.
C inaugurar a posição teórica conhecida como empirismo.
D estabelecer um princípio indubitável para o conhecimento.
E questionar a relação entre a filosofia e o tema da existência de Deus.",D
20,2015,CH - Ciências Humanas,,D1,"QUESTÃO 20  
No livro A ética protestante e o espírito do 
capitalismo, Max Weber escreve:
O impulso para o ganho, a perseguição do lucro, do 
dinheiro, da maior quantidade possível de dinheiro não 
tem, em si mesma, nada que ver com o capitalismo. 
Tal impulso existe e sempre existiu. Pode-se dizer que 
tem sido comum a toda sorte e condição humanas em 
todos os tempos e em todos os países, sempre que 
se tenha apresentada a possibilidade objetiva para 
tanto. O capitalismo, porém, identifica-se com a busca 
do lucro, do lucro sempre renovado por meio da empresa 
permanente, capitalista e racional. Pois assim deve ser: 
numa ordem completamente capitalista da sociedade, 
uma empresa individual que não tirasse vantagem das 
oportunidades de obter lucros estaria condenada à 
extinção.
O capitalismo moderno, segundo Max Weber, apresenta 
como característica fundamental a","
A competitividade decorrente da acumulação de capital. 
B implementação da flexibilidade produtiva e comercial.
C ação calculada e planejada para obter rentabilidade.
D socialização das condições de produção.
E mercantilização da força de trabalho.",C
21,2015,CH - Ciências Humanas,,D1,"QUESTÃO 21  
O filósofo Auguste Comte (1798-1857) preenche sua 
doutrina com uma imagem do progresso social na qual se 
conjugam ciência e política: a ação política deve assumir 
o aspecto de uma ação científica e a política deve ser 
estudada de maneira científica (a física social). Desde que 
a Revolução Francesa favoreceu a integração do povo na 
vida social, o positivismo obstina-se no programa de uma 
comunidade pacífica. E o Estado, instituição do “reino 
absoluto da lei”, é a garantia da ordem que impede o 
retorno potencial das revoluções e engendra o progresso. 
a característica do Estado positivo que lhe permite 
garantir não só a ordem, como também o desejado 
progresso das nações, é ser","
A espaço coletivo, onde as carências e desejos da população se realizam por meio das leis.
B produto científico da física social, transcendendo e transformando as exigências da realidade.
C elemento unificador, organizando e reprimindo, se necessário, as ações dos membros da comunidade.
D programa necessário, tal como a Revolução Francesa, devendo portanto se manter aberto a novas insurreições.
E agente repressor, tendo um papel importante a cada revolução, por impor pelo menos um curto período de ordem.",C
22,2015,CH - Ciências Humanas,,D1,"QUESTÃO 22  
Descrição da imagem: 
Tabela intitulada  
Estimativa do número de escravos africanos desembarcados no Brasil entre os anos de 1846 a 
1852, em que consta o ano e o número de escravos africanos desembarcados no Brasil:
1846: 64 262 escravos
1847: 75 893 escravos
1848: 76 338 escravos
1849: 70 827 escravos
1850: 37 672 escravos
1851: 7 058 escravos
1852: 1 234 escravos
a mudança apresentada na tabela é reflexo da Lei 
Eusébio de Queiróz que, em 1850,","
A aboliu a escravidão no território brasileiro.
B definiu o tráfico de escravos como pirataria.
C elevou as taxas para importação de escravos.
D libertou os escravos com mais de 60 anos.
E garantiu o direito de alforria aos escravos.",B
23,2015,CH - Ciências Humanas,,D1,"QUESTÃO 23  
O acúmulo gradual de sais nas camadas superiores 
do solo, um processo chamado salinização, retarda o 
crescimento das safras, diminui a produção das culturas 
e, consequentemente, mata as plantas e arruína o solo. ","
A salinização mais grave ocorre na Ásia, em especial na 
China, na Índia e no Paquistão.
O fenômeno descrito no texto representa um grande 
impacto ambiental em áreas agrícolas e tem como causa 
direta o(a)
A rotação de cultivos.
B associação de culturas.
C plantio em curvas de nível.
D manipulação genética das plantas.
E instalação de sistemas de irrigação.",E
24,2015,CH - Ciências Humanas,,D1,"QUESTÃO 24  
Descrição da imagem: 
Gráfico intitulado 
População residente, por situação do domicílio no Brasil de 1940 a 2000, que mostra o número de 
habitantes, em milhões de residentes, na zona urbana e na zona rural nesse período.
1940: 12,9 na urbana e 28,3 na rural. 
1950: 18,8 na urbana e 33,2 na rural. 
1960: 31,3 na urbana e 38,8 na rural.
1970: 52,1 na urbana e 41,1 na rural.
1980: 80,4 na urbana e 38,6 na rural.
1990: 111 na urbana e 35,8 na rural.
2000: 138 na urbana e 31,8 na rural.
O processo indicado no gráfico demonstra um aumento 
significativo da população urbana em relação à população 
rural no Brasil. Esse fenômeno pode ser explicado pela","
A atração de mão de obra pelo setor produtivo concentrado nas áreas urbanas.
B manutenção da instabilidade climática nas áreas rurais.
C concentração da oferta de ensino nas áreas urbanas.
D inclusão da população das áreas urbanas em programas assistenciais.
E redução dos subsídios para os setores da economia localizados nas áreas rurais.",A
25,2015,CH - Ciências Humanas,,D1,"QUESTÃO 25  
Os nossos ancestrais dedicavam-se à caça, à 
pesca e à coleta de frutas e vegetais, garantindo sua 
subsistência, porque ainda não conheciam as práticas de 
agricultura e pecuária. Uma vez esgotados os alimentos, 
viam-se obrigados a transferir o acampamento para 
outro lugar.
O texto refere-se ao movimento migratório denominado","
A sedentarismo.
B transumância.
C êxodo rural.
D nomadismo.
E pendularismo.",D
