id,year,area,sp_area,day,body,alternatives,answer
128,2015,LC - Linguagens e Códigos,,D2,"QUESTÃO 128  
 
   Estabeleça relações com as pessoas a sua volta. 
   Os relacionamentos são a base
da vida diária e investir tempo neles
enriquecerá seu dia e garantirá apoio
quando precisar. As pesquisas mostram
que quem tem menos de três pessoas
em sua rede de contatos próxima — entre
família e amigos — tem mais chance de 
desenvolver uma doença mental.
 
       Caminhe ou corra, ande de bicicleta, pratique um esporte,
dance. Os exercícios fazem as
pessoas se sentirem bem — o importante é
cada pessoa achar a atividade que lhe dá
prazer e que é adequada a seus limites.
Estudos de longo prazo sugerem que a
prática de uma atividade física previne
o declínio das capacidades mentais e
protege contra a ansiedade e a depressão. 
 
    Seja curioso, saboreie os momentos da vida e tome
consciência de como se sente.
Refletir sobre suas experiências ajuda
a descobrir o que realmente importa e
garantir que você viva o presente. Uma
pesquisa mostrou que pessoas treinadas
a prestar atenção em seus sentimentos
durante oito a 12 semanas apresentaram
melhora no bem-estar por anos.
  
       Tente algo novo, matricule-se em um curso, faça uma
nova tarefa no trabalho. Tente
consertar algo em casa. Aprenda a tocar
um instrumento ou a cozinhar. Escolha um
desafio que você vai gostar de perseguir.
Os estudos sugerem que o bem-estar está
ligado a ter metas — desde que elas sejam 
estabelecidas pelos próprios indivíduos e
tenham a ver com seus valores pessoais.
       Agradeça a alguém, ajude um
amigo ou um estranho. Sorria,
faça trabalho voluntário, junte-
se à associação do bairro. Olhe para fora,
além de olhar para dentro de si. Fazer parte
de uma comunidade traz benefícios — entre
eles relações sociais mais significativas.
As pesquisas mostram que as pessoas
que têm um interesse maior pelo outro
tendem a se considerar mais felizes.
Conecte-se
Seja ativo
Preste atenção
Continue aprendendo
Doe-se
Ao interagirmos socialmente, é comum deixarmos 
claro nosso posicionamento a respeito do assunto 
discutido. Para isso, muitas vezes, recorremos a 
determinadas estratégias argumentativas, dentre as 
quais se encontra o argumento de autoridade.
Considerando o texto em suas cinco partes, constata-se 
que há o emprego de argumento de autoridade no trecho:","
A “Seja curioso, saboreie os momentos da vida e tome 
consciência de como se sente. Refletir sobre suas 
experiências ajuda a descobrir o que realmente 
importa”.
B “As pesquisas mostram que quem tem menos de três 
pessoas em sua rede de contatos próxima [...] tem 
mais chances de desenvolver uma doença mental.”
C “Caminhe ou corra, ande de bicicleta, pratique um 
esporte, dance. Os exercícios fazem as pessoas se 
sentirem bem”.
D “Tente algo novo, matricule-se em um curso [...] 
Escolha um desafio que você vai gostar de perseguir.”
E “Fazer parte de uma comunidade traz benefícios — 
entre eles relações sociais mais significativas.",B
129,2015,LC - Linguagens e Códigos,,D2,"QUESTÃO 129  
Não adianta isolar o fumante
Se quiser mesmo combater o fumo, o governo precisa 
ir além das restrições. É preciso apoiar quem quer largar 
o cigarro.
Ao apoiar uma medida provisória para combater o 
fumo em locais públicos nos 27 estados brasileiros, o 
Senado reafirmou um valor fundamental: a defesa da 
saúde e da vida.
Em pelo menos um aspecto a MP 540/2011 é ainda 
mais rigorosa que as medidas em vigor em São Paulo, 
no Rio de Janeiro e no Paraná, estados que até agora 
adotaram as legislações mais duras contra o tabagismo. 
Ela proíbe os fumódromos em 100% dos locais fechados, 
incluindo até tabacarias, onde o fumo era autorizado sob 
determinadas condições.
Uma das principais medidas atinge o fumante no 
bolso. O governo fica autorizado a fixar um novo preço 
para o maço de cigarros. O Imposto sobre Produtos 
Industrializados (IPI) será elevado em 300%. Somando 
uma coisa e outra, o sabor de fumar se tornará muito mais 
ácido. Deverá subir 20% em 2012 e 55% em 2013.","
A visão fundamental da MP está correta. Sabe-se, há 
muito, que o tabaco faz mal à saúde. É razoável, portanto, 
que o Estado aja em nome da saúde pública.
O autor do texto analisa a aprovação da MP 540/2011 
pelo Senado, deixando clara a sua opinião sobre o tema. 
O trecho que apresenta uma avaliação pessoal do autor 
como uma estratégia de persuasão do leitor é:
A “Ela proíbe os fumódromos em 100% dos locais fechados”.
B “O governo fica autorizado a fixar um novo preço para o maço de cigarros.’’
C “O Imposto sobre Produtos Industrializados (IPI) será elevado em 300%.”
D “Somando uma coisa e outra, o sabor de fumar se tornará muito mais ácido.”
E “Deverá subir 20% em 2012 e 55% em 2013.",D
130,2015,LC - Linguagens e Códigos,,D2,"QUESTÃO 130  
Da timidez
Luís Fernando Veríssimo
Ser um tímido notório é uma contradição. O tímido tem 
horror a ser notado, quanto mais a ser notório. Se ficou 
notório por ser tímido, então tem que se explicar. Afinal, 
que retumbante timidez é essa, que atrai tanta atenção? 
Se ficou notório apesar de ser tímido, talvez estivesse se 
enganando junto com os outros e sua timidez seja apenas 
um estratagema para ser notado. Tão secreto que nem 
ele sabe. É como no paradoxo psicanalítico, só alguém 
que se acha muito superior procura o analista para tratar 
um complexo de inferioridade, porque só ele acha que se 
sentir inferior é doença. 
[...]
O tímido tenta se convencer de que só tem problemas 
com multidões, mas isto não é vantagem. Para o tímido, 
duas pessoas são uma multidão. Quando não consegue 
escapar e se vê diante de uma plateia, o tímido não pensa 
nos membros da plateia como indivíduos. Multiplica-os 
por quatro, pois cada indivíduo tem dois olhos e dois 
ouvidos. Quatro vias, portanto, para receber suas gafes. 
Não adianta pedir para a plateia fechar os olhos, ou tapar 
um olho e um ouvido para cortar o desconforto do tímido 
pela metade. Nada adianta. O tímido, em suma, é uma 
pessoa convencida de que é o centro do Universo, e que 
seu vexame ainda será lembrado quando as estrelas 
virarem pó.
Entre as estratégias de progressão textual presentes 
nesse trecho, identifica-se o emprego de elementos 
conectores. Os elementos que evidenciam noções 
semelhantes estão destacados em:","
A “Se ficou notório por ser tímido” e “[...] então tem que se explicar”.
B “[...] então tem que se explicar” e “[...] quando as estrelas virarem pó”.
C “[...] ficou notório apesar de ser tímido [...]” e “[...] mas isto não é vantagem [...]”.
D “[...] um estratagema para ser notado [...]” e “Tão secreto que nem ele sabe”.
E “[.",C
131,2015,LC - Linguagens e Códigos,,D2,"QUESTÃO 131  
Solidariedade
Murilo Mendes
Sou ligado pela herança do espírito e do sangue
Ao mártir, ao assassino, ao anarquista.
Sou ligado 
Aos casais na terra e no ar, 
Ao vendeiro da esquina,
Ao padre, ao mendigo, à mulher da vida,
Ao mecânico, ao poeta, ao soldado,
Ao santo e ao demônio,
Construídos à minha imagem e semelhança.
No poema, o sentimento de solidariedade, manifesto pelo 
eu lírico, fundamenta-se","
A no reconhecimento de traços de sua identidade na diversidade humana.
B na percepção de um elo espiritual entre ele e grupos excluídos socialmente.
C no conceito de preservação da individualidade em meio a grupos heterogêneos.
D na valorização da herança cultural compartilhada por indivíduos sem visibilidade social.
E no resgate da alteridade nivelada a partir de marcas de comportamento e crenças afins.",D
132,2015,LC - Linguagens e Códigos,,D2,"QUESTÃO 132  
E: Diva ... tem algumas ... alguma experiência pessoal 
que você passou e que você poderia me contar ... alguma 
coisa que marcou você? Uma experiência ... você poderia 
contar agora …
I: É ... tem uma que eu vivi quando eu estudava o 
terceiro ano científico lá no Atheneu ... né ... é:: eu gostava 
muito do laboratório de química ... eu ... eu ia ajudar os 
professores a limpar aquele material todo ... aqueles vidros 
... eu achava aquilo fantástico ... aquele monte de coisa ... 
né ... então ... todos os dias eu ia ... quando terminavam 
as aulas eu ajudava o professor a limpar o laboratório ... 
nesse dia não houve aula e o professor me chamou pra 
fazer uma limpeza geral no laboratório ... chegando lá 
... ele me fez uma experiência ... ele me mostrou uma 
coisa bem interessante que ... pegou um béquer com 
meio d’água e colocou um pouquinho de cloreto de sódio 
pastoso ... então foi aquele fogaréu desfilando ... aquele 
fogaréu ... quando o professor saiu ... eu chamei umas 
duas colegas minhas pra mostrar a experiência que eu 
tinha achado fantástico ... só que ... eu achei o seguinte ... 
se o professor colocou um pouquinho ... foi aquele desfile 
... imagine se eu colocasse mais ... peguei o mesmo 
béquer ... coloquei uma colher ... uma colher de cloreto 
de sódio ... foi um fogaréu tão grande ... foi uma explosão 
... quebrou todo o material que estava exposto em cima 
da mesa ... eu branca ... eu fiquei ... olha ... eu pensei que 
eu fosse morrer sabe ... quando ... o colégio inteiro correu 
pro laboratório pra ver o que tinha sido ... 
Na transcrição de fala, especialmente, no trecho “eu 
branca ... eu fiquei ... olha ... eu pensei que eu fosse 
morrer sabe...”, há uma estrutura sintática fragmentada, 
embora facilmente interpretável. Sua presença na fala 
revela ","
A distração e poucos anos de escolaridade.
B falta de coesão e coerência na apresentação das ideias.
C afeto e amizade entre os participantes da conversação.
D desconhecimento das regras de sintaxe da norma padrão.
E característica do planejamento e execução simultânea desse discurso.",E
133,2015,LC - Linguagens e Códigos,,D2,"QUESTÃO 133  
O mundo das grandes inovações tecnológicas, dos 
avanços das pesquisas médicas e que já presenciou o 
envio de homens ao espaço é o mesmo lugar onde 1 bilhão 
de pessoas dormem e acordam com fome. A  desnutrição 
ocupa o primeiro lugar no ranking dos 10 maiores riscos à 
saúde e mata mais do que a aids, a malária e a tuberculose 
combinadas. O equivalente às populações da Europa e 
da América do Norte, juntas, está de barriga vazia. E um 
futuro famélico aguarda a raça humana. Em 2050, apenas 
por razões ligadas às mudanças climáticas, o número de 
pessoas sem comida no prato vai aumentar em até 20%.
Considerando a natureza do tema, a forma como está 
apresentado e o meio pelo qual é veiculado o texto, 
percebe-se que seu principal objetivo é","
A divulgar dados estatísticos recentes sobre a fome no mundo e sobre as inovações tecnológicas.
B esclarecer questões científicas acerca dos danos causados pela fome e pela aids nos indivíduos.
C demonstrar que a fome, juntamente com as doenças endêmicas, também é um problema de saúde pública.
D convidar o leitor a engajar-se em alguma ação positiva contra a fome, a partir da divulgação de dados alarmantes.
E alertar sobre o problema da fome, apresentando-o como um contraste no mundo de tantos recursos tecnológicos.",E
134,2015,LC - Linguagens e Códigos,,D2,"QUESTÃO 134  
TEXTO I
Voluntário
Inglês de Sousa
Rosa tecia redes, e os produtos de sua pequena 
indústria gozavam de boa fama nos arredores. A reputação 
da tapuia crescera com a feitura de uma maqueira de 
tucum ornamentada com a coroa brasileira, obra de 
ingênuo gosto, que lhe valera a admiração de toda a 
comarca e provocara a inveja da célebre Ana Raimunda, 
de Óbidos, a qual chegara a formar uma fortunazinha com 
aquela especialidade, quando a indústria norte-americana 
reduzira à inatividade os teares rotineiros do Amazonas.
TEXTO II
Relato de um certo oriente
Milton Hatoum
Emilie, ao contrário de meu pai, de Dorner e dos 
nossos vizinhos, não tinha vivido no interior do Amazonas. 
Ela, como eu, jamais atravessara o rio. Manaus era o seu 
mundo visível. O outro latejava na sua memória. Imantada 
por uma voz melodiosa, quase encantada, Emilie 
maravilha-se com a descrição da trepadeira que espanta 
a inveja, das folhas malhadas de um tajá que reproduz a 
fortuna de um homem, das receitas de curandeiros que 
veem em certas ervas da floresta o enigma das doenças 
mais temíveis, com as infusões de coloração sanguínea 
aconselhadas para aliviar trinta e seis dores do corpo 
humano. “E existem ervas que não curam nada”, revelava 
a lavadeira, “mas assanham a mente da gente. Basta 
tomar um gole do líquido fervendo para que o cristão 
sonhe uma única noite muitas vidas diferentes”. Esse 
relato poderia ser de duvidosa veracidade para outras 
pessoas, mas não para Emilie.
As representações da Amazônia na literatura brasileira 
mantêm relação com o papel atribuído à região na 
construção do imaginário nacional. Pertencentes a 
contextos históricos distintos, os fragmentos diferenciam-se 
ao propor uma representação da realidade amazônica em 
que se evidenciam","
A aspectos da produção econômica e da cura na tradição popular.
B manifestações culturais autênticas e da resignação familiar.
C valores sociais autóctones e influência dos estrangeiros.
D formas de resistência locais e do cultivo das superstições.
E costumes domésticos e levantamento das tradições indígenas.",A
135,2015,LC - Linguagens e Códigos,,D2,"QUESTÃO 135  
Descrição da imagem: Charge com destaque 
para a palavra involution. Há o desenho da evolução 
do homem, que se inicia com um primata, evolui 
para uma figura humana segurando uma lança. Na 
sequência, há outra figura humana segurando uma 
garrafa e, por último, um primata, ao lado de uma 
garrafa, tentando se equilibrar sobre as duas pernas.","
A palavra inglesa “involution” traduz-se como involução 
ou regressão. A construção da imagem com base 
na combinação do verbal com o não verbal revela a 
intenção de
A denunciar o retrocesso da humanidade.
B criticar o consumo de bebida alcoólica pelos humanos.
C satirizar a caracterização dos humanos como primatas.
D elogiar a teoria da evolução humana pela seleção natural.
E fazer um trocadilho com as palavras inovação e involução.",B
136,2015,MT - Matemática e Códigos,,D2,"QUESTÃO 136  
Os cerca de 40 mil engenheiros formados anualmente 
no Brasil não serão suficientes para atender à demanda 
de 300 mil profissionais da área, necessários para 
obras e investimentos previstos para os próximos cinco 
anos, como os da Copa do Mundo, das Olimpíadas, 
do Programa de Aceleração do Crescimento (PAC) 
e do petróleo do pré-sal. Apesar dessa demanda, um 
dos fatores causadores do desinteresse pelos cursos 
de engenharia são os necessários conhecimentos 
em matemática. Um exemplo de habilidade que um 
engenheiro deve ter é de desenhar um objeto real com 
5 metros de comprimento, numa escala de um para vinte. 
Considere que todo o comprimento do papel deve ser 
usado.
Qual é o comprimento necessário, em centímetros, do 
papel para fazer esse desenho?","
A 10.
B 20.
C 25.
D 40.
E 100.",C
137,2015,MT - Matemática e Códigos,,D2,"QUESTÃO 137  
Um técnico precisa consertar o termostato do aparelho 
de ar-condicionado de um escritório, que está desregulado. ","
A temperatura T, em graus Celsius, no escritório, varia de 
acordo com a função T de h igual a A mais B vezes seno 
abre parêntese no numerador pi no denominador 12 abre 
parêntese h menos 12 fecha parêntese, fecha parêntese, 
sendo h o tempo, medido em horas, a partir da meia-noite abre 
parêntese zero menor ou igual a h menor que 24 e A e B os 
parâmetros que o técnico precisa regular. Os funcionários 
do escritório pediram que a temperatura máxima fosse 
26 graus celsius, a mínima 18 graus celsius, e que durante 
a tarde a temperatura fosse menor do que durante a manhã.
Quais devem ser os valores de A e de B para que o pedido 
dos funcionários seja atendido?
A A = 18 e B = 8.
B A = 22 e B = -4.
C A = 22 e B = 4 .
D A = 26 e B = -8.
E A = 26 e B = 8.",B
138,2015,MT - Matemática e Códigos,,D2,"QUESTÃO 138  
Num campeonato de futebol de 2012, um time sagrou-se 
campeão com um total de 77 pontos (P) em 38 jogos, 
tendo 22 vitórias (V), 11 empates (E) e 5 derrotas (D). 
No critério adotado para esse ano, somente as vitórias e 
empates têm pontuações positivas e inteiras. As derrotas 
têm valor zero e o valor de cada vitória é maior que o valor 
de cada empate.
Um torcedor, considerando a fórmula da soma de 
pontos injusta, propôs aos organizadores do campeonato 
que, para o ano de 2013, o time derrotado em cada partida 
perca 2 pontos, privilegiando os times que perdem menos 
ao longo do campeonato. Cada vitória e cada empate 
continuariam com a mesma pontuação de 2012.
Qual a expressão que fornece a quantidade de pontos (P), 
em função do número de vitórias (V), do número de 
empates (E) e do número de derrotas (D), no sistema de 
pontuação proposto pelo torcedor para o ano de 2013?","
A P igual a 3 vezes V mais E.
B P igual a 3 vezes V menos 2 vezes D.
C P igual a 3 vezes V mais E menos D.
D P igual a 3 vezes V mais E menos 2 vezes D.
E P igual a 3 vezes V mais E mais 2 vezes D.",D
139,2015,MT - Matemática e Códigos,,D2,"QUESTÃO 139  
O gráfico mostra a variação percentual do valor do 
Produto Interno Bruto (PIB) do Brasil, por trimestre, em 
relação ao trimestre anterior:
Descrição do gráfico: Gráfico de segmentos 
que apresenta os seguintes dados:
2009 – primeiro trimestre: -1,92; segundo trimestre: 1,87; 
terceiro trimestre: 2,57; e quarto trimestre: 2,45.
2010 – primeiro trimestre: 2,19; segundo trimestre: 1,59; 
terceiro trimestre: 0,39; e quarto trimestre: 0,75.
2011 – primeiro trimestre: 1,1.
De acordo com o gráfico, no período considerado, o 
trimestre em que o Brasil teve o maior valor do PIB foi o","
A segundo trimestre de 2009.
B quarto trimestre de 2009.
C terceiro trimestre de 2010.
D quarto trimestre de 2010.
E primeiro trimestre de 2011.",E
140,2015,MT - Matemática e Códigos,,D2,QUESTÃO 140  ,"
A Organização Mundial da Saúde (OMS) 
recomenda que o consumo diário de sal de cozinha 
não exceda 5 gramas. Sabe-se que o sal de cozinha 
é composto por 40 por cento de sódio e 60 por cento 
de cloro.
Qual é a quantidade máxima de sódio proveniente do sal 
de cozinha, recomendada pela OMS, que uma pessoa 
pode ingerir por dia?
A 1 250 miligramas.
B 2 000 miligramas.
C 3 000 miligramas.
D 5 000 miligramas.
E 12 500 miligramas.",B
141,2015,MT - Matemática e Códigos,,D2,"QUESTÃO 141  
Um fornecedor vendia caixas de leite a um 
supermercado por R$ 1,50 a unidade. O supermercado 
costumava comprar 3 000 caixas de leite por mês desse 
fornecedor. Uma forte seca, ocorrida na região onde o 
leite é produzido, forçou o fornecedor a encarecer o preço 
de venda em 40 por cento. O supermercado decidiu 
então cortar em 20 por cento a compra mensal dessas 
caixas de leite. Após essas mudanças, o fornecedor 
verificou que sua receita nas vendas ao supermercado 
tinha aumentado.
O aumento da receita nas vendas do fornecedor, em 
reais, foi de","
A 540.
B 600.
C 900.
D 1 260.
E 1 500.",A
142,2015,MT - Matemática e Códigos,,D2,"QUESTÃO 142  
Cinco amigos marcaram uma viagem à praia em 
dezembro. Para economizar, combinaram de ir num 
único carro. Cada amigo anotou quantos quilômetros seu 
carro fez, em média, por litro de gasolina, nos meses de 
setembro, outubro e novembro. Ao final desse trimestre, 
calcularam a média dos três valores obtidos para 
escolherem o carro mais econômico, ou seja, o que teve 
a maior média. Os dados estão representados na tabela:
Descrição da tabela: Tabela que apresenta o 
desempenho médio mensal em quilômetros por litro
Carro I – Setembro: 6,2 quilômetros por litro; 
Outubro: 9,0 quilômetros por litro; Novembro: 9,3 
quilômetros por litro.
Carro II – Setembro: 6,7 quilômetros por litro; 
Outubro: 6,8 quilômetros por litro; Novembro: 9,5 
quilômetros por litro. 
Carro III – Setembro: 8,3 quilômetros por litro; 
Outubro: 8,7 quilômetros por litro; Novembro: 9,0 
quilômetros por litro.
Carro IV – Setembro: 8,5 quilômetros por litro; 
Outubro: 7,5 quilômetros por litro; Novembro: 8,5 
quilômetros por litro.
Carro V – Setembro: 8,0 quilômetros por litro; 
Outubro: 8,0 quilômetros por litro; Novembro: 8,0 
quilômetros por litro.
Qual carro os amigos deverão escolher para a viagem?","
A I.
B II.
C III.
D IV.
E V.",C
143,2015,MT - Matemática e Códigos,,D2,"QUESTÃO 143  
Um paciente precisa ser submetido a um 
tratamento, sob orientação médica, com determinado 
medicamento. Há cinco possibilidades de medicação, 
variando a dosagem e o intervalo de ingestão do 
medicamento. As opções apresentadas são:
A: um comprimido de 400 miligramas, de 3 em 3 
horas, durante 1 semana;
B: um comprimido de 400 miligramas, de 4 em 4 
horas, durante 10 dias;
C: um comprimido de 400 miligramas, de 6 em 6 
horas, durante 2 semanas;
D: um comprimido de 500 miligramas, de 8 em 8 
horas, durante 10 dias;
E: um comprimido de 500 miligramas, de 12 em 12 
horas, durante 2 semanas.
Para evitar efeitos colaterais e intoxicação, a 
recomendação é que a quantidade total de massa 
da medicação ingerida, em miligramas, seja a menor 
possível.
Seguindo a recomendação, deve ser escolhida a opção","
A A.
B B.
C C.
D D.
E E.",E
144,2015,MT - Matemática e Códigos,,D2,"QUESTÃO 144  
Pedro e José são operários da construção civil. Eles 
carregavam vários sacos de areia idênticos em carrinhos 
de mão, quando Pedro começou a reclamar da tarefa. 
Nesse momento, José desabafou: “Do que você está 
reclamando, Pedro? Se você me der um saco de areia, 
carregarei o dobro de sacos que você! E se eu lhe der um 
saco de areia, carregaremos a mesma quantidade”.
Na situação descrita, quantos sacos de areia carregava 
José?","
A 5.
B 6.
C 7.
D 8.
E 9.",C
145,2015,MT - Matemática e Códigos,,D2,"QUESTÃO 145  
O sindicato de trabalhadores de uma empresa 
sugere que o piso salarial da classe seja de R$ 1 800,00, 
propondo um aumento percentual fixo por cada ano 
dedicado ao trabalho. A expressão que corresponde à 
proposta salarial (s), em função do tempo de serviço (t), 
em anos, é s de t igual a 1 800 vezes abre parêntese 1,03 
fecha parêntese elevado a t.
De acordo com a proposta do sindicato, o salário de um 
profissional dessa empresa com 2 anos de tempo de 
serviço será, em reais,","
A 7 416,00.
B 3 819,24.
C 3 709,62.
D 3 708,00.
E 1 909,62.",E
146,2015,MT - Matemática e Códigos,,D2,"QUESTÃO 146  
O modelo predador-presa foi proposto de forma 
independente por Alfred J. Lotka, em 1925, e Vito 
Volterra, em 1926. Esse modelo descreve a interação 
entre duas espécies, sendo que uma delas dispõe de 
alimentos para sobreviver (presa) e a outra se alimenta 
da primeira (predador). Considere que o gráfico 
representa uma interação predador-presa, relacionando 
a população do predador com a população da sua presa 
ao longo dos anos.
Descrição do gráfico: Gráfico de linhas com as 
seguintes informações: no eixo horizontal, tempo, 
em anos, de 0 a 80, com intervalo de 5 em 5; e no 
eixo vertical, população, de 0 a 60, com intervalo de 
5 em 5. ","
A população da presa e a população do predador 
estão representadas por linhas sinuosas que se 
cruzam nos pontos: (7 ; 10), (18 ; 35), (26 ; 12), (36 ; 34), 
(44 ; 12), (53 ; 34), (62 ; 12), (71 ; 34) e (78 ; 12).
De acordo com o gráfico, nos primeiros quarenta anos, 
quantas vezes a população do predador se igualou à 
da presa?
A 2.
B 3.
C 4.
D 5.
E 9.",C
